title,company,location,description
Player Care - QA Analyst - Monopoly GO!,Scopely,Spain,"About the job Scopely is looking for a Player Care - QA Analyst to join our Monopoly Go! team in Sevilla or Barcelona on a hybrid basis. At Scopely, we care deeply about what we do and want to inspire play, every day - whether in our work environments alongside our talented colleagues, or through our deep connections with our communities of players. We are a global team of game lovers who are developing, publishing and innovating the mobile games industry, connecting millions of people around the world daily. Monopoly GO! is our new casual game and a key franchise that has just become one of Scopely’s largest games enjoyed by millions of players. The team is based in Europe and the US, and works every day to create captivating new experiences for our players. What You Will Do Reporting to the Audience KPIs QA Lead, you will play a key role in bridging the Player Care and QA teams on MonopolyGo. You’ll collaborate with both internal and external partners to investigate player-reported Production issues, helping to identify and escalate the most impactful issues that require development support. As a key contributor to the culture of quality within Scopely, you will help shape the future on how we continue to iterate to success, and evolve the way we work. Be the QA DRI for the Customer Support team, supporting quality control both in terms of Live defect investigation, and general player experience Monitor and actively participate in daily Bug Escalation channels, helping to clarify issues, ensure accurate documentation, and support effective triaging Work closely with external embedded QA testers, providing task assignments, feedback, and mentorship to support their integration into the Customer Support team Collaborate with the Customer Support team on process improvements, with a focus on enhancing bug identification, communication workflows and player experience Own, manage, and continuously refine the Customer Support bug escalation process to ensure efficiency and clarity Contribute to the development and upkeep of Customer Support bug dashboards, maintaining readiness to speak to player-facing quality issues at any time Support the creation of release patch notes and community messaging related to known issues and confirmed fixes Provide troubleshooting guidance and expert advice to all tiers of support agents on escalated bugs Assist in compiling Customer Support stakeholder reports by flagging critical or widespread quality concerns and advocating for timely resolutions Design, produce and distribute new or existing reports to a variety of stakeholders, using large pools of data and presenting them in a simple but insightful way Develop a deep understanding of all product features to accurately assess player concerns, validate issues, and participate in QA playtests for upcoming features Understanding the QA Lifecycle from conception through to post release care, ensuring user experience is a key consideration throughout Coordinate with Internal QA’s to create Test Plans that support the investigation of live defects, and if applicable, the verification of live defects. Coordinate with external QA teams, including embedded testers, to define support priorities, communicate requirements, and monitor progress and outcomes Collaborate with relevant QA DRIs to reproduce and diagnose complex or widespread player-reported issues, reducing the number of “Cannot Reproduce” tickets in the database Review and align external test teams to expected bug reporting standards, maintaining a clean, prioritized, and well-organized bug database in coordination with cross-functional pods Lead by example through hands-on testing, owning and taking responsibility for the quality output of your issue investigations Keep leadership informed on task progress, daily priorities, and blockers to ensure transparency and alignment Attend Customer Support and QA ceremonies, using these as a platform for feedback, while remaining current and informed on team strategy and movements Be aware of and monitor app health from an holistic viewpoint, such as ANRs & Crash Rates Engage in annual reviews to aid with yours and others development alike, providing feedback when called upon, including to that of your lead / manager Support QA Leadership in attaining the teams goals through ownership and tracking of KPOs / OKRs Lead by example with regards to the Scopely tenets What We’re Looking For Deep understanding of the role of Customer Support and Player Experience, with a strong commitment to delivering the best possible service to our players Exceptional verbal / written communication and an excellent attention to detail Strong time management, accountability and organisational skills Confident in negotiation and advocacy, ensuring both you and your team’s perspectives are heard while balancing business needs and priorities effectively Proactive, enthusiastic and self-motivated, able to work independently with minimal supervision. Skilled in process improvement with a focus on key stakeholders, balancing user experience with business needs. Flexible to an agile setup with the ability to multitask A strong commercial awareness with an understanding of business priorities and goals Experienced in Excel-based data analysis, leveraging formulas, graphs and tools to generate meaningful insights and deliver exceptional reporting. Extensive knowledge of JIRA and / or similar bug tracking systems Helpshift and / or similar CS ticketing platforms Looker, Kibana, Bugsnag and internal Admin pages Active Player on Production Mobile exposure and an understanding of Apple / Google submission protocol A sound understanding of the gaming industry and the typical end to end development lifecycle At Scopely, we create games for everyone - and want to ensure that the people behind our games reflect that! We are committed to creating a diverse, supportive work environment where everyone is treated with respect. We are committed to providing equal employment opportunities and welcome individuals from all backgrounds to join us & embrace the adventure! About Us Scopely is a global interactive entertainment and mobile-first video game company, home to many top, award-winning experiences such as ""MONOPOLY GO!,"" “Star Trek™ Fleet Command,” “Stumble Guys,” “MARVEL Strike Force,” and “Yahtzee® With Buddies,” among others. Scopely creates, publishes, and live-operates immersive games that empower a directed-by-consumer™ experience across multiple platforms--from mobile, web, PC and beyond. Founded in 2011, Scopely is fueled by a world-class team and a proprietary technology platform Playgami that supports one of the most diversified portfolios in the games industry. Recognized multiple times as one of Fast Company’s “World’s Most Innovative Companies,” Scopely is a multi-billion-dollar business due to its ability to create long-lasting game experiences that players enjoy for years. Scopely has global operations in more than a dozen markets across Asia, EMEA, and North America, and is home to many internal game development teams, referred to as Scopely Studios, with additional game studio partners across four continents. Scopely was acquired by Savvy Games Group in July 2023 for $4.9 billion, and is now an independent subsidiary of Savvy. For more information on Scopely, visit: scopely.com Notice to candidates: Scopely, Inc and its affiliates will never request payment or ask for financial information as a condition for applying to a position or receiving an offer of employment. All official Scopely, Inc. recruiters only use email domains that end with @scopely.com. Our official website is www.scopely.com. Please only apply to positions posted on our official website and ensure the recruiter only communicates via the official email domain. Should you have any questions or encounter any fraudulent requests/emails/websites, please immediately contact recruiting@scopely.com. Our job applicant privacy policies are available here: California Privacy Notice and EEA/UK Privacy Notice. Employment at Scopely is based solely on a person's merit and qualifications. Scopely does not discriminate against any employee or applicant because of race, creed, color, religion, gender, sexual orientation, gender identity/expression, national origin, disability, age, genetic information, veteran status, marital status, pregnancy or related condition (including breastfeeding), or any other basis protected by law. We also consider qualified applicants with arrest or conviction records, consistent with applicable federal, state and local law."
"Responsable de Planificación, Seguimiento de Negocio y Operaciones Territorial_DT Levante",AXA,"Valencia, Valencian Community, Spain","About the job MISION: Liderar la coordinación en el diseño y seguimiento del plan de negocio de su Territorial de acuerdo con la estrategia del Área de Distribución con el objetivo de garantizar la sostenibilidad y rentabilidad en su ámbito de intervención. Dinamizar e impulsar la utilización de los procedimientos, aplicaciones y herramientas, con especial foco en la mejora de la Calidad de Servicio, alcanzar la digitalización de las operaciones y desarrollar la rentabilidad y la eficiencia en la red de distribuidores a través del asesoramiento, la formación y la intervención in situ, de acuerdo con las prioridades estratégicas de la compañía. PRINCIPALES ACTIVIDADES / RESPONSABILIDADES: Coordinación, planificación y seguimiento del plan de negocio de la Territorial, de acuerdo con la estrategia del Área y de la Dirección Territorial. Seguimiento de planes, objetivos, actividad y rentabilidad, seguimiento de la productividad y eficiencia de los equipos. Capacitación de los equipos en la comprensión y manejo de los KPIs de negocio para la toma de decisiones, el diseño y monitorización de planes de acción. Asegurar la calidad del servicio postventa territorial, garantizando el cumplimiento de los planes de acción y objetivos de servicio fijados en el Territorio. Asegurar el cumplimiento de los compromisos de calidad de servicio en el Territorio (Atención Telefónica, encuestas de Agentes y Corredores, Sello de Calidad de las Agencias, cumplimiento de los plazos de respuesta de cada departamento de la DT (Técnica, Emisión…) Asegurar el cumplimiento de la normativa Compliance de AXA España. PERFIL: Licenciatura en ADE, Derecho, Económicas, Ingeniería. Gestión del dato procesos internos y aplicativos Cía. Conocimientos de la mediación y del Negocio asegurador Experiencia en puesto afines: 6 a 8 años. En AXA promovemos activamente la Diversidad e Inclusión ofreciendo igualdad de oportunidades. Se valorará positivamente la posesión de certificado de Discapacidad. ¿A qué estás esperando? ¡Únete a la familia AXA y contribuye al progreso de la sociedad!"
Supply Chain Sales Specialist,Imperia SCM,"Valencia, Valencian Community, Spain","About the job En Imperia desarrollamos y comercializamos nuestro software de planificación de la cadena de suministro para que nuestros clientes puedan planificar de manera óptima su demanda, producción y compras. Si quieres hacer carrera en ventas B2B, ¡este es tu sitio! 🚀 🔍 Qué buscamos Persona con excelentes habilidades verbales y escritas. Capacidad de gestionar el tiempo de forma eficaz. Inglés (alto o nativo). Valoraremos positivamente que tengas conocimientos en italiano o francés. 🎯 Serás responsable de… Generar oportunidades a través de la búsqueda activa de clientes potenciales en canales como LinkedIn. Desarrollar y gestionar tu propia cartera de clientes construyendo relaciones cercanas, duraderas y basadas en la confianza. Acompañar al cliente durante todo el proceso, desde la primera toma de contacto hasta el cierre de la venta. 🍀Condiciones y beneficios Conciliación laboral y personal: no tenemos horario de entrada y salida fijo y los viernes hacemos jornada intensiva. Estabilidad laboral: contrato indefinido a jornada completa. Modalidad de trabajo híbrida: (3 días de oficina + 2 de teletrabajo). Revisiones salariales cada 6 meses. Oficinas luminosas ubicadas en el Puerto de Valencia. 23 días de vacaciones y la tarde del día de cumpleaños libre. Eventos y afterworks. Posibilidad de crecimiento y plan de carrera. 🙌🏼 Qué esperamos de ti Mentalidad de crecimiento: ganas de superarse, aprender y buscar ser mejor cada día. Responsabilidad sobre el trabajo: sentido de responsabilidad y compromiso con lo que haces. Sinceridad y transparencia: autenticidad en cada cosa que hagas."
Governance Risk & Compliance Analyst,XTEL,European Union,"About the job About XTEL At XTEL, we excel in understanding large FMCG players. As a leading software provider of sales automation solutions for the Consumer Goods Industry worldwide, our mission is to partner with our customers to unlock growth through smart investment and optimize their promotional plans. Position Overview XTEL is looking for a GRC Analyst who is driven, curious, and eager to grow. You’ll work directly with the Director of Information Assurance to help build and scale a forward-thinking and efficient security & compliance program. This isn’t a check the box compliance role, we’re looking for someone who wants to reimagine how GRC is done and isn’t afraid to roll up their sleeves to make it happen. This is an ideal opportunity for someone earlier in their GRC career who is looking to learn, contribute meaningfully, and be part of a high impact team. Responsibilities Support the ongoing operation and improvement of XTEL’s ISMS. Draft, review, and maintain security & compliance policies, standards, and procedures, ensuring they meet evolving compliance requirements and business needs. Assist with risk assessments and treatment plans. Contribute to our Third Party Risk Management (TPRM) efforts for evaluating vendors beyond just sending out lengthy questionnaires. Assist with client security questionnaires, RFPs, and due diligence requests. Help monitor compliance obligations across frameworks including ISO 27001, SOC 2, SOC 1/ISAE 3402, GDPR, and NIS2. Support ESG initiatives by collecting, analyzing, and reporting on sustainability metrics, including greenhouse gas emissions and energy usage, to meet investor and stakeholder requirements. Assist in responding to customer RFPs and inquiries related to ESG, ensuring alignment with sustainability goals and regulatory frameworks. Collaborate with stakeholders across IT, Product, Engineering, HR, etc. to implement security controls. Continuously look for ways to automate, streamline, and modernize how we manage compliance and security operations. Contribute to incident response and BCP/DRP planning and testing. Qualifications You’re motivated, adaptable, and eager to learn. You have 2-5 years of experience in security, compliance, or risk management roles, particularly in cloud based SaaS environments. You have hands on experience with ISO 27001 and SOC 2. You think of GRC as more than just documentation and spreadsheets – you see it as a system to be optimized and improved with technology. You’ve supported or helped manage ISMS operations and understand what makes policies and procedures useful. You participated in or supported risk assessments. You’re organized, self-directed, and thrive in environments where you can take ownership. Nice to have: Experience using GRC platforms such as Drata, Vanta, Secureframe, etc. Experience within Microsoft 365 and Azure environments. Experience with automation, low-code tools, or scripting to improve workflows and documentation processes. What We Offer A challenging role in a fast-growing AI-driven revenue management company. A diverse and international team with strong ownership and a can-do mentality. Opportunities to contribute to the organization's growth and development. A cross-functional role spanning geographies and departments. Flexible working with hybrid and remote options (HQ in Bologna). Location Preferences: Our headquarters is located in Casalecchio di Reno, Bologna, and we offer hybrid work arrangements. While we prioritize candidates who are based in Bologna and the surrounding areas for hybrid work, we are open to considering other options on a case-by-case basis. Equal Opportunity Statement If you have strengths to share, we’d love to hear from you. We value diverse backgrounds and experiences, so don’t hesitate to apply even if you don’t meet all criteria. XTEL is an equal opportunity employer and values diversity at our company. We do not discriminate on the basis of race, religion, color, national origin, sex, gender, gender expression, sexual orientation, age, marital status, veteran status, or disability status. We will ensure that individuals with disabilities are provided reasonable accommodation to participate in the job application or interview process, to perform crucial job functions, and to receive other benefits and privileges of employment."
Business Analyst,Sollers Consulting,"Valencia, Valencian Community, Spain","About the job About Business Consulting: Continuous growth and agile way of collaboration defines our Business path. Everything we do – from requirements analysis, through testing to creating new solutions – is done with passion and high-quality assurance. With an open mind and business advisory craft at hand, our innovative teams lead our international clients to success. About our promises. We can offer 🧭 Flexible working hours and a hybrid home office model (2-3 times per week in the office) as work-life balance is crucial at Sollers 💸 A chance to be promoted twice a year 🏸 A clearly defined career path and salary forecast 🌱 Opportunities for growth with a training budget that you can use for courses, conferences. We also provide access to an online course platform and organize and co-fund language classes 🧒 An internal coach to guide you through the onboarding and further training and career opportunities and a budget to be used for your lunches together 🐕‍🦺 A chance to #domore for the planet and the community as part of Sollers Change Makers - our volunteering program 🎉 Lots of teambuilding activities, trips, hobby groups and cultural events to create a company powered by teamwork 🎮🍦 Great places to work: comfortable offices in city centers with chill zones (foosball tables, PS5, etc.) and team lunches on regular basis 🧘 🤸💊 Probably all the benefits you can think of About the role. You will: Be a part of consulting or implementation team during IT projects for financial institutions, primarily insurance companies Conduct business analysis, define functional requirements, and test developed solutions and support UATs Work closely with software developers and IT architects on a daily basis Be an active member of an Agile team, taking ownership for your topics Test yourself in various roles performing varied tasks in an international environment About the requirements. You need: At least 2 years of experience in IT projects for the financial sector, preferably insurance or bancassurance. At least a bachelor's degree, preferably in finance, business, economics, IT, or similar fields. Great command of English and Spanish language, being fully confident collaborating with native speakers (at least C1 level). Understanding agile ways of working. Proven ability to apply both intuitive and analytical reasoning to approach complex problems. To be able to work in Spain and the European Union on a full-time basis. Willingness to travel regularly. About the wishes. Nice to haves: Familiarity with insurance business processes. Experience working in fintech, consulting, implementation, or IT company, especially in the fields of insurance or bancassurance. Team leadership skills and management experience. Additional languages. While having the main office in Valencia, you want to work with our Clients abroad, traveling up to 50% of your work time."
Murex Business Analyst 100% Remoto,Advoost,Spain,"About the job 🚀 We’re looking for you! Ready to take on a new challenge? This is your moment! Join our team as a We are looking for a Murex Business Analyst with experience in Murex configuration and financial product analysis. The role involves managing financial data, configuring views and reports, and resolving incidents. 🏢💻 Responsibilities: Manage P&L, sensitivities, and other financial data. Configure simulation views and dynamic reports. Insert and manage events and transactions in Murex. Resolve incidents and discrepancies in data and configurations. Configure financial products (derivatives, bonds, etc.). Maintain static and market data within Murex. Manage GOM (Operational Model) configurations. Knowledge of the MRB module (preferred). Requirements: Experience with Murex and financial products. Knowledge of report configuration and data management. Strong problem-solving skills to resolve incidents and technical issues. Knowledge of MRB (preferred). Fluent in English & Spanish. What will your experience be like with us? Collaborative and flexible environment: Join a team that thrives on collaboration and values a positive work culture. 😊 Social benefits: Enjoy meal tickets, transportation tickets, English classes, health insurance, and much more! 🏥🍽️ Growth and development: With a permanent contract, annual performance reviews, continuous training, and regular updates to your benefits based on your career growth. 📈 What’s next? You’ve read this far, so we know you’re interested 😉 Now’s the time! Apply for the position, and we’ll review your CV. If we think you're a great fit, we’ll invite you to up to two interviews (plus one with the client). We’ll discuss the details of the role and compensation at the end of the process, but first, we want to get to know you and understand what you bring to the table! 💬 Ready to join us? We’re excited to meet you! 🙌"
