title,company,location,description
Backend AI Engineer,Shakers,"Valencia, Valencian Community, Spain","About the job Hi! 👋🏼 At Shakers, we're looking for a Backend AI Engineer to take our AI engineering efforts to the next level 🚀 Team and Role If you have strong backend software engineering experience, follow excellent development practices, understand hexagonal architecture and Domain-Driven Design (DDD), and have a keen interest in exploring or deepening your experience with Artificial Intelligence, we'd love to meet you! This role offers an exciting opportunity to join a fast-growing tech startup, collaborating closely with cross-functional teams (product, business, and engineering). We're a small, agile, committed team where you'll quickly learn and directly contribute to developing AI applications with real-world impact. If you're looking for interesting technical challenges, scalability, and you're excited about seeing your work reach real users, this is your place! 🤩 We’re looking for someone passionate about building robust and scalable backend systems, interested in learning about integrating and deploying AI solutions efficiently, reliably, and maintainability. What you´ll be doing Your day-to-day as an Backend AI Engineer As a Backend AI Engineer, you'll work closely with one of our AI-focused squads, primarily doing: Backend Development in Python: Design and implement robust backend systems following best practices (version control, unit tests, documentation). Hexagonal Architecture and Domain-Driven Design: Apply these methodologies to build flexible, scalable, and maintainable systems. Integration with AI APIs: Connect backend solutions to external services like OpenAI, Anthropic, Gemini AI, etc. Conversational Systems Development: Technically implement chatbots and virtual assistants integrated into our products. Technical Implementation of RAG Systems (Retrieval Augmented Generation): Develop backend components to generate contextualized responses using generative models. Technical and Cost Optimization: Continuously improve performance, scalability, and cost-efficiency of AI backend systems. Performance and Quality Evaluation: Implement technical testing and QA processes to ensure code quality and system stability. Cross-Functional Collaboration: Actively collaborate with product and engineering teams to align solutions with strategic goals. What we´re looking for We need someone who... Has at least 2-4 years of backend development experience in Python, especially in startups or tech companies. Follows good development practices: version control, documentation, unit testing. Has solid knowledge of hexagonal architecture, Domain-Driven Design (DDD), and design patterns. Has experience or interest in integrating external APIs and developing product-focused software. Shows genuine interest in growing within the field of product-oriented Artificial Intelligence. It’s a strong plus if you have experience in... Integration with AI APIs (OpenAI, Anthropic, Hugging Face, Gemini AI, etc.). Conversational systems and chatbot development. Specialized AI libraries and tools such as LangChain, LlamaIndex, or LangFlow. Docker, CI/CD, DevOps practices, and cloud deployment (AWS, Azure, GCP). API frameworks like FastAPI or similar. Methodologies and practices for evaluating AI models. What's in it for you? Compensation 💰 The salary range for this position is between 26.000€ and 46.000€ OTE (on target earnings) gross annual salary. The salary consists of: Between 26.000€ & 40.000€ fixed salary. Up to 15% (6.000€) quarterly bonus based on performance & potential. Why you´ll love working at Shakers 💚 Be part of a rapidly growing, internationally expanding startup. 🌍 Have an ambitious professional development plan to help you reach your full potential. Enjoy an unbeatable team culture—ask anyone on our team! Take advantage of our hybrid ful flex methodology: a mix of remote and in-office work, with our office located in the heart of Madrid, Calle Velázquez. Perks include wellness programs, gym access, English classes, medical insurance, and more. At the office... 📍 Organic fruit Free caffeine and theine Our recruitment process As a startup, we are very agile and we like to see results quickly, which is why prioritize efficiency in our recruitment process. Our goal is to have you onboard this May, so you can hit the ground running and make an impact from day one! The Road to Joining Our Team Round 1, Cultural Fit: Kick things off with an informal chat with our People & Culture team. Don’t worry—we just want to get to know you better, learn about your goals, hobbies, and more! Round 2, Case Study & Technical Skills with Product Team: Join two members of our Product team for a deep dive into a case study. This is your chance to showcase your client management skills and demonstrate how you approach problem-solving. Round 3, Meet the Team: Have a conversation with additional team members to further explore your skillset and ensure there's a great cultural fit. This is also your chance to ask questions and see how we collaborate. Final check, CEO Chat: Meet Héctor, our CEO! He’s excited to connect with you, talk about Shakers’ future, and discuss your vision and expectations. More about Shakers At Shakers we imagine, design, and create the next-generation way of working. Our vision is to be the leading community and platform in the world that helps companies work with freelance teams through our technology. We are a 70-person, fast growing startup based in Madrid. It's the place for you if you're looking for a high-performance, very dynamic & technological environment surrounded by ambitious people! Our DNA At Shakers, we are obsessed with our values. Half of our bonuses are performance-based, and the other half come from embodying what it means to be a true Shaker! WINNING TEAM 🏆 We all feel like part of a winning team—one that pushes boundaries, challenges the status quo, and moves the needle! We set ambitious goals and seek people who are driven to achieve them. F1C10 💪🏼 We’re building an environment where fear doesn’t hold us back. Experimentation and learning from failure are part of our DNA. Fail fast, grow faster. Fail 1X, chase 10X. We value risk-takers who aren’t afraid to go big! STAY HUMBLE 🤲🏼 We embrace a beginner’s mindset—always evolving, always learning, and always finding new solutions. At Shakers, humility combined with ambition fuels our success, and when we blend the two, the results are extraordinary! A huge thanks for being interested in Shakers, we'd love to see you soon."
Especialista en Customer Care,Octopus Energy,"Valencia, Valencian Community, Spain","About the job Valencia (ES) Octopus Energy Services Spain 🇪🇸 – Central Support / Full-time / Hybrid 🌍 Revolucionamos la energía para cambiar el mundo En Octopus Energy, no somos una eléctrica tradicional. Somos un equipo de personas apasionadas que trabaja cada día para hacer que la energía sea 100% renovable, accesible y justa para todos. Creemos en la tecnología y la innovación como motores del cambio. Queremos transformar la forma en que el mundo consume energía, eliminando barreras, simplificando procesos y ofreciendo un servicio más humano y transparente. Por esto mismo, nuestro compromiso es claro: la energía limpia debe ser la norma, no la excepción. Para lograrlo, combinamos sostenibilidad con un enfoque centrado en las personas, impulsando un servicio excepcional y construyendo un equipo increíble que comparte nuestra visión. 💡 Pero nada de esto sería posible sin personas como tú. Para seguir creciendo y transformando el mercado, buscamos talento con ganas de marcar la diferencia. Si quieres formar parte de este cambio, aportar tu energía y ayudar a construir un futuro más verde. ¿Qué estamos buscando? Como Especialista de Customer Care serás la voz y el apoyo principal de Octopus ante nuestros clientes. Tu misión será acompañarlos de principio a fin en su experiencia con nuestros productos y servicios, principalmente en el proceso de instalación de paneles solares. Resolverás dudas, gestionarás incidencias y harás todo lo posible para que cada cliente se sienta bien cuidado y respaldado. Serás parte clave de la experiencia excepcional Octopus. 🐙 Lo llamamos el ‘Efecto Octopus’ Trabajar en Octopus Energy significa formar parte de una compañía donde la cultura y las personas son lo más importante. 💜 Apostamos por la flexibilidad y la conciliación. 🚀 Queremos que desarrolles tu potencial al máximo. 🌱 Creemos en un modelo energético más justo y sostenible. ¡Te estamos esperando! 🚀 🔧 ¿Qué harás en tu día a día? Acompañar al cliente en todo el proceso de instalación de paneles solares. Resolver dudas, canalizar incidencias y coordinar la solución con los equipos técnicos. Familiarizarse con los productos y servicios de la empresa. Atención de los canales de comunicación: telefónico, WhatsApp, mail. Gestionar herramientas de ticketing (Desk u otras). Hacer seguimiento postventa de reclamos e incidencias para asegurar una experiencia 10/10. Detectar oportunidades de mejora en los procesos de atención. Coordinarte con otros departamentos como Ventas, Ingeniería o Mantenimiento para resolución de incidencias. Mantener registros claros y organizados de cada caso o solicitud. 🎯 ¿Qué necesitas para brillar en este rol? Formación de FP o Grado Superior (preferencia: Administración, Atención al cliente, Energías Renovables). Conocimiento básico o interés por instalaciones fotovoltaicas. Manejo de herramientas informáticas (CRM, ticketing, correo, Excel). Proactividad y enfoque a resolución de problemas. Paciencia, empatía y orientación a cliente. Comunicación clara y efectiva. Capacidad de priorizar tareas y autogestionarse. Trabajo en equipo y actitud positiva. 💜 Lo que te ofrecemos 📍 Ubicación: Valencia 🏢 Modalidad: Híbrida. ⏳ Horario: 40h semanales - Jornada Completa. 📈 Beneficios extra: 💰 Share options de Octopus Energy. ☕ Desayuno y fruta en la oficina. 🏥 Retribución flexible (restaurante, transporte, guardería, seguro médico...). 🚘 Ayudas para la compra de vehículos eléctricos. 🏦 Plan de pensiones. 🎓 Formación en producto y desarrollo profesional. 🎉 Ambiente dinámico, cercano y divertido. 🍽️ Eventos: Family Dinner y muchas más experiencias en equipo. 💚 ¿Por qué te encantará trabajar aquí? En Octopus Energy, hacemos las cosas diferentes. Creemos en un entorno laboral donde puedas ser tú mismo/a, desarrollarte profesionalmente y sentirte parte de un equipo que realmente quiere cambiar el mundo. ¡Somos un Great Place to Work! 🏆✨ En Glassdoor, hemos sido reconocidos como una de las 50 mejores empresas para trabajar y nuestra cultura ha sido destacada en múltiples ocasiones. 🎙️ Si quieres conocer más sobre cómo trabajamos, escucha nuestro CEO en este podcast sobre nuestra cultura y valores. 📩 ¿Te unes al cambio? Si quieres formar parte de este proyecto y ayudar a construir un futuro más verde, ¡envíanos tu candidatura! 🌱 📎 Adjunta tu CV y, si tu perfil encaja, nos pondremos en contacto contigo. ¡Estamos deseando conocerte! 😉"
Gestor/a Energético/a (Valencia),Octopus Energy,"Valencia, Valencian Community, Spain","About the job Valencia (ES) Octopus Energy Spain 🇪🇸 – Customer Operations / Full-time / Hybrid 🌍 Revolucionamos la energía para cambiar el mundo En Octopus Energy, no somos una eléctrica tradicional. Somos un equipo de personas apasionadas que trabaja cada día para hacer que la energía sea 100% renovable, accesible y justa para todos. Creemos en la tecnología y la innovación como motores del cambio. Queremos transformar la forma en que el mundo consume energía, eliminando barreras, simplificando procesos y ofreciendo un servicio más humano y transparente. Por esto mismo, nuestro compromiso es claro: la energía limpia debe ser la norma, no la excepción. Para lograrlo, combinamos sostenibilidad con un enfoque centrado en las personas, impulsando un servicio excepcional y construyendo un equipo increíble que comparte nuestra visión. 💡 Pero nada de esto sería posible sin personas como tú. Para seguir creciendo y transformando el mercado, buscamos talento con ganas de marcar la diferencia. Si quieres formar parte de este cambio, aportar tu energía y ayudar a construir un futuro más verde. ¿Qué estamos buscando? Buscamos un/a Gestor/a Energético para unirse a nuestro equipo y ayudarnos a seguir revolucionando el sector energético. Si tienes experiencia en atención al cliente, te motiva trabajar en un entorno dinámico y te apasiona la sostenibilidad, esta es tu oportunidad. 🐙 Lo llamamos el ‘Efecto Octopus’ Trabajar en Octopus Energy significa formar parte de una compañía donde la cultura y las personas son lo más importante. 💜 Apostamos por la flexibilidad y la conciliación. 🚀 Queremos que desarrolles tu potencial al máximo. 🌱 Creemos en un modelo energético más justo y sostenible. ¡Te estamos esperando! 🚀🐙 ¿Buscas un trabajo con impacto y flexibilidad? 🚀 Estamos en búsqueda de gestores/as energéticos/as para nuestras oficinas de Valencia. Tenemos diferentes horarios para que encuentres el que mejor encaje contigo: 🟣 Horario flexible: trabaja entre viernes, sábado y domingo (eligiendo al menos dos de estos días) y acuerda tu horario con tu equipo con antelación. 🟢 Horario estándar: jornada completa de lunes a jueves de 9h a 18:30h y viernes de 9h a 15h. ¡Tú eliges el modelo que mejor se adapte a tu estilo de vida! 📝 ¿Qué harás en tu día a día? Hablar con los/las clientes/as por teléfono y correo electrónico para resolver sus dudas. Trabajando en Operaciones, serás el corazón de la compañía: tu principal objetivo será ayudar a los clientes, dándoles mucho OctoLove 💜 Tendrás la responsabilidad total de los asuntos que lleguen a tus manos, resolviendo las dudas de los clientes en cualquier área del sector energético. No pasamos llamadas para que los clientes se vuelvan locos/as hablando cada vez con gente diferente. Estarás capacitado/a para resolver cualquier incidencia que se te presente. Espera lo inesperado. Cada día aprenderás cosas nuevas. Te preguntarán cosas diferentes que quizá no sepas… por suerte trabajarás con un equipo increíble que siempre estará a tu lado para ayudarte y formarte para que cada vez sea mejor profesional y que des un mejor servicio a los clientes. 🎯 ¿Qué necesitas para brillar en este rol? Experiencia en atención al cliente (al menos 1 año en asesoramiento telefónico o similar). Un enfoque centrado en el/la cliente/a, con paciencia y empatía. Capacidad de adaptación a un entorno dinámico y en constante evolución. Nivel de inglés valorado positivamente (no imprescindible, pero suma puntos). 💜 Lo que te ofrecemos 📍 Ubicación: Valencia, formato híbrido. ⏳ Horario: 40h semanales - Jornada Completa 📈 Beneficios extra: 💰 Share options de Octopus Energy ☕ Desayuno y fruta en la oficina 🏥 Retribución flexible (comida, transporte, guardería, seguro médico...) 🚘 Ayudas para la compra de vehículos eléctricos 🏦 Plan de pensiones 🎓 Formación en producto y desarrollo profesional 🎉 Ambiente dinámico, cercano y divertido 🍽️ Eventos: Family Dinner y muchas más experiencias en equipo 💚 ¿Por qué te encantará trabajar aquí? En Octopus Energy, hacemos las cosas diferentes. Creemos en un entorno laboral donde puedas ser tú mismo/a, desarrollarte profesionalmente y sentirte parte de un equipo que realmente quiere cambiar el mundo. 🏆 ¡Somos un Great Place to Work! En Glassdoor, hemos sido reconocidos como una de las 50 mejores empresas para trabajar y nuestra cultura ha sido destacada en múltiples ocasiones. 🎙️ Si quieres conocer más sobre cómo trabajamos, escucha a nuestro CEO en este podcast sobre nuestra cultura y valores. 📩 ¿Te unes al cambio? Si quieres formar parte de este proyecto y ayudar a construir un futuro más verde, ¡envíanos tu candidatura! 🌱 📎 Adjunta tu CV y, si tu perfil encaja, nos pondremos en contacto contigo. ¡Estamos deseando conocerte! 😉"
Product Analyst – Optimización de flujos de compra y configuración,Fourvenues,"Valencia, Valencian Community, Spain","About the job Product Analyst – Optimización de flujos de compra y configuración En Fourvenues estamos revolucionando un mercado global de más de 100 mil millones de dólares, potenciando discotecas, festivales, beach clubs, promotoras y bares de copas en todo el mundo. Estamos buscando un/a Product Analyst – Optimización de flujos de compra y configuración, para trabajar en nuestras oficinas de Valencia, que tenga ganas de dejar una huella importante en su carrera y quiera unirse a una empresa de alto crecimiento. Si tienes autoexigencia, ambición, curiosidad y compromiso para llevar a Fourvenues al siguiente nivel, ¡queremos conocerte! Localización: Valencia (modalidad híbrida) Reporte a: CPO Tu día a día... Analizar cómo los usuarios interactúan con los flujos de compra de entradas y reserva de mesas VIP, identificando puntos de fricción y oportunidades de mejora. Evaluar y optimizar flujos de configuración y gestión B2B (tarifas, asignación de mesas, gestión de accesos). Diseñar, medir y analizar funnels y cohortes para entender comportamiento y conversión. Proponer y evaluar experimentos (A/B testing) para validar hipótesis de producto. Colaborar con Product Managers y equipo de diseño/desarrollo para priorizar mejoras de impacto. Crear dashboards y reportes claros para stakeholders, transformando datos en decisiones. Que necesitamos de ti… Domine SQL y herramientas de visualización (Looker, Tableau, Power BI o similares). Tenga experiencia con herramientas de analítica de producto (Mixpanel, Amplitude, GA4, etc.). Conozca estadística y experimentación (funnels, cohortes, A/B testing). Pueda traducir datos en conclusiones claras para equipos técnicos y no técnicos. Sea curioso y tenga mentalidad de descubrimiento: sepa proponer hipótesis, no solo reportar datos. Tenga experiencia en entornos SaaS, B2B2C o eCommerce. Valoramos... Conoces Python o R para automatizar reportes o análisis complejos. Has trabajado con métricas de retención, engagement, CAC o LTV. Tienes experiencia colaborando con Product Managers en decisiones de roadmap. Te motiva trabajar en un entorno ágil, dinámico y orientado a resultados. Qué ofrecemos… Compensación salarial competitiva, enfocada en atraer y retener perfiles de alto rendimiento. Bonus anuales para aquellos perfiles que contribuyan de forma sobresaliente en el éxito de la empresa. Plan de carrera con oportunidades de promoción y desarrollo continuo. Nos encanta apostar por la gente de casa. Una visión y un equipo que te inspirará a superarte, llevándote al siguiente nivel en tu desarrollo profesional. Formación continua. Queremos que siempre estés a la vanguardia en tecnología y habilidades, por lo que ofrecemos formaciones internas constantes. Ordenador MacBook y pantallas de alta resolución para desarrollar tu potencial al máximo. Modalidad híbrida (3+2). Tres días de oficina y dos desde casa si así te sientes mas productiv@, aunque estamos seguros de que el ambiente y el equipo te harán disfrutar de nuestra oficina más de lo esperado. Flexibilidad horaria. Como cada persona rinde mejor a su manera, te damos la libertad de organizar tu tiempo de trabajo entre las 8:00h y las 20:00h, siempre cumpliendo con los compromisos agendados. Clases de inglés voluntarias. Impartidas por profesores nativos, para que mejores tu nivel de manera efectiva. Seguro médico privado. Nos preocupamos por tu bienestar y ofrecemos cobertura médica para que tengas la tranquilidad que necesitas. Retribución flexible opcional. Este beneficio lo puedes utilizar en restaurantes, guardería, transporte y descuentos en grandes marcas. Días de vacaciones extra. Disfrutarás de días adicionales en fechas especiales como cumpleaños, navidades o eventos únicos. Sobre Fourvenues... Fourvenues, es la empresa B2B que está liderando la transformación digital en la industria del ocio nocturno. Nos dirigimos a un mercado global de más de 100 mil millones de dólares, abarcando discotecas, festivales, beach clubs, promotoras y bares de copas. Nuestra visión es clara: convertirnos en el sistema operativo de la industria, con un alto componente financiero y un modelo vertical SaaS (vSaaS) que impulse a nuestros clientes a conseguir sus objetivos. Su éxito, es el nuestro. En nuestros tres primeros años hemos multiplicado nuestros ingresos x20, y solo pensamos en ir a por más. Por eso, crecer un mínimo de 100% anual es nuestra meta, y eso exige un ambiente donde el compromiso, la autoexigencia y la curiosidad constante son clave. Aquí, la excelencia no es opcional; es la norma. Tenemos el privilegio de trabajar con marcas de renombre mundial, entre ellas Pacha, BRESH, Cova Santa, BCM, Magic Room HK, Blackworks, Sonorama Medellin, Opium o Gossip Doha. Y lo mejor, es que no paramos de cerrar nuevos partnerships cada mes, por lo que siempre tenemos desafíos que nos impulsan a esforzarnos al máximo para dar un servicio de diez. Si estás en ese momento de tu carrera, en el que estás listo para dejar huella, explotando todo tu potencial y ser parte de una empresa en plena expansión, ¡este es tu lugar! Aquí puedes conocer más de nuestro negocio y nuestra historia: https://www.youtube.com/watch?v=5ratQVugh7o"
Social Media & Content Growth Specialist,Imperia SCM,"Valencia, Valencian Community, Spain","About the job En Imperia desarrollamos y comercializamos una solución de software especializada en la planificación de la cadena de suministro, que permite a nuestros clientes anticipar cuánto van a vender, producir y distribuir. Como Social Media & Content Growth Specialist, serás la persona responsable planificar, crear y adaptar contenidos que impulsen nuestra presencia digital, posicionamiento y notoriedad, gestionando la comunicación en redes sociales con un enfoque B2B estratégico, profesional y creativo. Si ves las redes sociales como un canal para construir marca, generar impacto y contar historias que conectan… ¡te estamos buscando! 👨🏽‍💻 Requisitos para el puesto Experiencia previa generando contenido en entornos B2B. Dominio de LinkedIn como canal clave para contenido corporativo. Capacidad para redactar textos atractivos, con buena redacción y atención al detalle. Conocimiento básico de herramientas de diseño, edición y/o gestión de redes sociales. Buen criterio visual y facilidad para adaptarse a un estilo de marca definido. 🔍 Se valorará positivamente Interés o experiencia en sectores industriales o tecnológicos. Nivel alto de inglés. Conocimiento de un tercer idioma (preferentemente italiano o francés). 🎯 Serás responsable de… Gestión de redes sociales y estrategia digital Planificar, publicar y mantener activos los perfiles sociales actuales de Imperia (LinkedIn, X y YouTube). Diseñar y liderar desde cero el lanzamiento del canal Meta (Instagram y Facebook), incluyendo estrategia de crecimiento, tono de comunicación y tipo de contenido. Crear una estrategia de crecimiento en redes sociales, diversificando formatos y adaptando los mensajes a cada plataforma. Gestionar comunidades y dinamizar la interacción con nuestra audiencia. Investigar perfiles relevantes e influencers en redes sociales alineados con nuestra marca. Creación de contenido B2B Redactar contenidos adaptados a nuestros públicos objetivo: desde posts en redes hasta pequeñas piezas visuales o audiovisuales. Mantener una voz de marca coherente: cercana, profesional y con personalidad, adaptada a cada canal. Colaborar en la redacción y difusión de contenidos corporativos para perfiles clave de la compañía, incluyendo estrategia de thought leadership. Gestión de contenidos e internacionalización Organizar y gestionar todo el contenido inbound de la compañía. Coordinar la traducción de los contenidos a los distintos idiomas en los que opera la marca (ES, EN, IT, FR). 🍀 Qué ofrecemos Conciliación real: no tenemos horario fijo de entrada y salida, y los viernes hacemos jornada intensiva. Contrato indefinido a jornada completa desde el primer día. Modalidad de trabajo híbrida: 3 días en oficina y 2 días de teletrabajo. Revisiones salariales: cada 6 meses. Oficinas luminosas en el Puerto de Valencia. 23 días laborables de vacaciones y la tarde libre el día de tu cumpleaños. Eventos de equipo, afterworks y muy buen rollo. Posibilidades reales de crecimiento. 🙌🏼 Qué esperamos de ti Mentalidad de crecimiento: ganas de aprender, superarte y ser mejor cada día. Responsabilidad sobre el trabajo: sentido de responsabilidad y compromiso con lo que haces. Sinceridad y transparencia: autenticidad en cada cosa que hagas. ¿Te unes al equipo? ¡Te estamos esperando! 🚀"
